{
  "$schema": "https://json-schema.org/draft/2020-12/schema",
  "$id": "https://github.com/sealdice/sealdice-js-ext-template/extension.schema.json",
  "title": "SealDice extension metadata",
  "type": "object",
  "additionalProperties": false,
  "required": [
    "id",
    "name",
    "author",
    "version",
    "description",
    "license",
    "homepageUrl"
  ],
  "properties": {
    "$schema": { "type": "string" },
    "id": {
      "type": "string",
      "pattern": "^[a-z0-9][a-z0-9-]{1,62}[a-z0-9]$"
    },
    "name": { "type": "string", "minLength": 1 },
    "author": { "type": "string", "minLength": 1 },
    "version": {
      "type": "string",
      "pattern": "^(?:0|[1-9][0-9]*)\\.(?:0|[1-9][0-9]*)\\.(?:0|[1-9][0-9]*)(?:-[0-9A-Za-z-]+(?:\\.[0-9A-Za-z-]+)*)?(?:\\+[0-9A-Za-z-]+(?:\\.[0-9A-Za-z-]+)*)?$"
    },
    "description": { "type": "string", "minLength": 1 },
    "license": { "type": "string", "minLength": 1 },
    "homepageUrl": { "type": "string", "format": "uri" }
  }
}
